{
  "schemaVersion": "1.0",
  "id": "plugin.jszmajda.linked-intent-dev",
  "type": "plugin",
  "name": "Linked Intent Dev",
  "slug": "linked-intent-dev",
  "vendor": "jszmajda",
  "description": "Linked-Intent Development - a SDD methodology for agentic coding",
  "version": "1.4.2",
  "homepage": "https://github.com/jszmajda/lid",
  "provider": "DipoleML",
  "categories": [
    "plugin",
    "agentic-coding",
    "ai-coding",
    "claude-code-plugin",
    "ears",
    "linked-intent-development",
    "methodology",
    "spec-driven-development"
  ],
  "tags": [
    "agentic-coding",
    "ai-coding",
    "claude-code",
    "claude-code-plugin",
    "ears",
    "linked-intent-development",
    "llm",
    "methodology",
    "spec-driven-development"
  ],
  "capabilities": [],
  "logo": {
    "file": "logo.png",
    "brand": "jszmajda",
    "brandName": "jszmajda",
    "source": "https://github.com/jszmajda.png",
    "license": "GitHub owner avatar; trademark of respective owner",
    "retrievedAt": "2026-10-29T00:13:35Z",
    "resolver": "github-avatar"
  },
  "source": {
    "repo": "jszmajda/lid",
    "url": "https://github.com/jszmajda/lid",
    "commit": "4e24477cd6bfbc219dda91f5617aefb162370865",
    "path": "plugins/linked-intent-dev",
    "license": "MIT",
    "licenseClass": "green",
    "stars": 115,
    "archived": false,
    "vendoredAt": "2026-10-29T00:03:55Z"
  },
  "neutralization": {
    "applied": true,
    "originalProvider": "claude,cursor",
    "changes": [
      {
        "file": ".claude-plugin/",
        "before": "active provider manifest",
        "after": "_upstream/provider-manifests/claude/.claude-plugin",
        "reason": "archive provider manifest; DipoleML manifest generated"
      },
      {
        "file": ".cursor-plugin/",
        "before": "active provider manifest",
        "after": "_upstream/provider-manifests/cursor/.cursor-plugin",
        "reason": "archive provider manifest; DipoleML manifest generated"
      },
      {
        "file": ".dipoleml-plugin/plugin.json",
        "before": "",
        "after": "generated",
        "reason": "DipoleML-native plugin manifest"
      }
    ]
  },
  "entrypoints": [
    {
      "kind": "plugin",
      "manifest": ".dipoleml-plugin/plugin.json"
    }
  ],
  "requirements": {
    "runtimes": [],
    "packages": [],
    "env": [],
    "credentials": []
  },
  "compatibility": {
    "upstreamProviders": [
      "claude",
      "cursor"
    ],
    "notes": "Upstream executable code is unmodified. Provider manifests are archived under _upstream/ and DipoleML metadata is authoritative.",
    "dipoleml": ">=1.0"
  },
  "files": {
    "manifest": "dipoleml.json",
    "readme": "DIPOLEML.md",
    "license": "LICENSE",
    "logo": "logo.png"
  },
  "quality": {
    "validated": false,
    "checks": [
      "license:MIT",
      "provider-archived",
      "manifest-generated"
    ]
  }
}
