{
  "schemaVersion": "1.0",
  "id": "plugin.k-dash.typemux-cc",
  "type": "plugin",
  "name": "Typemux CC",
  "slug": "typemux-cc",
  "vendor": "k-dash",
  "description": "DipoleML plugin: Python type-checker LSP multiplexer. Auto-detects .venv and routes to pyright/ty/pyrefly—no DipoleML restart.",
  "version": "0.2.18",
  "homepage": "https://github.com/K-dash/typemux-cc",
  "provider": "DipoleML",
  "categories": [
    "plugin",
    "claude-plugin",
    "lsp",
    "pyrefly",
    "pyright",
    "ty"
  ],
  "tags": [
    "claude-code",
    "claude-plugin",
    "lsp",
    "plugin",
    "pyrefly",
    "pyright",
    "python",
    "ty"
  ],
  "capabilities": [],
  "logo": {
    "file": "logo.png",
    "brand": "k-dash",
    "brandName": "k-dash",
    "source": "https://github.com/K-dash.png",
    "license": "GitHub owner avatar; trademark of respective owner",
    "retrievedAt": "2026-10-29T00:13:37Z",
    "resolver": "github-avatar"
  },
  "source": {
    "repo": "K-dash/typemux-cc",
    "url": "https://github.com/K-dash/typemux-cc",
    "commit": "8f23a983fdfbb9928e3e3460a80c4c0ca5047fc1",
    "path": "",
    "license": "MIT",
    "licenseClass": "green",
    "stars": 17,
    "archived": false,
    "vendoredAt": "2026-10-28T23:50:56Z"
  },
  "neutralization": {
    "applied": true,
    "originalProvider": "claude",
    "changes": [
      {
        "file": ".claude-plugin/",
        "before": "active provider manifest",
        "after": "_upstream/provider-manifests/claude/.claude-plugin",
        "reason": "archive provider manifest; DipoleML manifest generated"
      },
      {
        "file": ".claude/",
        "before": "active provider manifest",
        "after": "_upstream/provider-manifests/claude/.claude",
        "reason": "archive provider manifest; DipoleML manifest generated"
      },
      {
        "file": "CLAUDE.md",
        "before": "provider-specific agent instructions",
        "after": "_upstream/provider-manifests/claude/CLAUDE.md",
        "reason": "archive provider instructions; DIPOLEML.md is authoritative"
      },
      {
        "file": "dipoleml.json",
        "before": "Typemux CC | Claude Code plugin: Python type-checker LSP multiplexer. Auto-detects .venv and routes to pyright/ty/pyrefly—no Claude Code restart.",
        "after": "Typemux CC | DipoleML plugin: Python type-checker LSP multiplexer. Auto-detects .venv and routes to pyright/ty/pyrefly—no DipoleML restart.",
        "reason": "provider branding rewritten to DipoleML in generated metadata"
      },
      {
        "file": ".dipoleml-plugin/plugin.json",
        "before": "Python type-checker LSP multiplexer for Claude Code (pyright, ty, pyrefly)",
        "after": "Python type-checker LSP multiplexer for DipoleML (pyright, ty, pyrefly)",
        "reason": "provider branding rewritten to DipoleML in generated metadata"
      },
      {
        "file": ".dipoleml-plugin/plugin.json",
        "before": "",
        "after": "generated",
        "reason": "DipoleML-native plugin manifest"
      }
    ]
  },
  "entrypoints": [
    {
      "kind": "plugin",
      "manifest": ".dipoleml-plugin/plugin.json"
    }
  ],
  "requirements": {
    "runtimes": [],
    "packages": [],
    "env": [],
    "credentials": []
  },
  "compatibility": {
    "upstreamProviders": [
      "claude"
    ],
    "notes": "Upstream executable code is unmodified. Provider manifests are archived under _upstream/ and DipoleML metadata is authoritative.",
    "dipoleml": ">=1.0"
  },
  "files": {
    "manifest": "dipoleml.json",
    "readme": "DIPOLEML.md",
    "license": "LICENSE",
    "logo": "logo.png"
  },
  "quality": {
    "validated": false,
    "checks": [
      "license:MIT",
      "provider-archived",
      "manifest-generated"
    ]
  }
}
