{
  "schemaVersion": "1.0",
  "id": "plugin.agricidaniel.dipoleml-blog",
  "type": "plugin",
  "name": "DipoleML Blog",
  "slug": "dipoleml-blog",
  "vendor": "agricidaniel",
  "description": "DipoleML blog skill suite: 30 sub-skills, 5 agents, 5-gate v1.9.0 Blog Delivery Contract, dual-optimized for Google rankings and AI citations. Active development at AI-Marketing-Hub/DipoleML-blog (AI Marketing Hub Pro community); public releases ship here.",
  "version": "2.3.1",
  "homepage": "https://github.com/AgriciDaniel/claude-blog",
  "provider": "DipoleML",
  "categories": [
    "plugin",
    "agent-skills",
    "ai-citations",
    "ai-content",
    "ai-marketing",
    "ai-marketing-hub",
    "blog",
    "blog-writing",
    "claude-code-skill",
    "claude-plugin"
  ],
  "tags": [
    "agent-skills",
    "ai",
    "ai-citations",
    "ai-content",
    "ai-marketing",
    "ai-marketing-hub",
    "blog",
    "blog-writing",
    "claude-code",
    "claude-code-skill",
    "claude-plugin",
    "claude-skill",
    "content-creation",
    "content-optimization",
    "content-strategy",
    "eeat",
    "geo",
    "multilingual",
    "open-source",
    "seo"
  ],
  "capabilities": [],
  "logo": {
    "file": "logo.svg",
    "brand": "unity",
    "brandName": "unity",
    "source": "https://cdn.simpleicons.org/unity",
    "license": "CC0-1.0 (Simple Icons); trademark of brand owner",
    "retrievedAt": "2026-10-29T00:12:04Z",
    "resolver": "simple-icons:slug"
  },
  "source": {
    "repo": "AgriciDaniel/claude-blog",
    "url": "https://github.com/AgriciDaniel/claude-blog",
    "commit": "354442348815a7f0327077ad89af2c43cf4b4ab4",
    "path": "",
    "license": "MIT",
    "licenseClass": "green",
    "stars": 2564,
    "archived": false,
    "vendoredAt": "2026-10-28T23:58:37Z"
  },
  "neutralization": {
    "applied": true,
    "originalProvider": "claude",
    "changes": [
      {
        "file": ".claude-plugin/",
        "before": "active provider manifest",
        "after": "_upstream/provider-manifests/claude/.claude-plugin",
        "reason": "archive provider manifest; DipoleML manifest generated"
      },
      {
        "file": "CLAUDE.md",
        "before": "provider-specific agent instructions",
        "after": "_upstream/provider-manifests/claude/CLAUDE.md",
        "reason": "archive provider instructions; DIPOLEML.md is authoritative"
      },
      {
        "file": "dipoleml.json",
        "before": "Claude Blog | Claude Code blog skill suite: 30 sub-skills, 5 agents, 5-gate v1.9.0 Blog Delivery Contract, dual-optimized for Google rankings and AI citations. Active development at AI-Marketing-Hub/claude-blog (AI Marketing Hub Pro community); public releases ship here.",
        "after": "DipoleML Blog | DipoleML blog skill suite: 30 sub-skills, 5 agents, 5-gate v1.9.0 Blog Delivery Contract, dual-optimized for Google rankings and AI citations. Active development at AI-Marketing-Hub/DipoleML-blog (AI Marketing Hub Pro community); public releases ship here.",
        "reason": "provider branding rewritten to DipoleML in generated metadata"
      },
      {
        "file": ".dipoleml-plugin/plugin.json",
        "before": "",
        "after": "generated",
        "reason": "DipoleML-native plugin manifest"
      },
      {
        "file": "dipoleml.json",
        "before": "claude-blog",
        "after": "dipoleml-blog",
        "reason": "provider token neutralized in slug/id"
      }
    ]
  },
  "entrypoints": [
    {
      "kind": "plugin",
      "manifest": ".dipoleml-plugin/plugin.json"
    }
  ],
  "requirements": {
    "runtimes": [
      "python3",
      "python3"
    ],
    "packages": [
      "claude-blog"
    ],
    "env": [
      "CLAUDE_BLOG_URL"
    ],
    "credentials": []
  },
  "compatibility": {
    "upstreamProviders": [
      "claude"
    ],
    "notes": "Upstream executable code is unmodified. Provider manifests are archived under _upstream/ and DipoleML metadata is authoritative.",
    "dipoleml": ">=1.0"
  },
  "files": {
    "manifest": "dipoleml.json",
    "readme": "DIPOLEML.md",
    "license": "LICENSE",
    "logo": "logo.svg"
  },
  "quality": {
    "validated": false,
    "checks": [
      "license:MIT",
      "provider-archived",
      "manifest-generated"
    ]
  }
}
