{
  "schemaVersion": "1.0",
  "id": "plugin.prajapatimehul.aws-cost-saver",
  "type": "plugin",
  "name": "Aws Cost Saver",
  "slug": "aws-cost-saver",
  "vendor": "prajapatimehul",
  "description": "DipoleML plugin that finds AWS cost savings. 163 checks across EC2, RDS, S3, Lambda, and 30+ services.",
  "version": "2.1.0",
  "homepage": "https://github.com/prajapatimehul/claude-aws-cost-saver",
  "provider": "DipoleML",
  "categories": [
    "plugin",
    "aws",
    "aws-cost",
    "claude-plugin",
    "cloud-computing",
    "cloud-cost",
    "cost-optimization",
    "cost-savings",
    "devops",
    "ec2"
  ],
  "tags": [
    "ai-tools",
    "aws",
    "aws-cost",
    "claude-code",
    "claude-plugin",
    "cloud-computing",
    "cloud-cost",
    "cost-optimization",
    "cost-savings",
    "devops",
    "ec2",
    "finops",
    "lambda",
    "rds",
    "s3"
  ],
  "capabilities": [],
  "logo": {
    "file": "logo.png",
    "brand": "amazonwebservices",
    "brandName": "amazonwebservices",
    "source": "https://github.com/prajapatimehul.png",
    "license": "GitHub owner avatar; trademark of respective owner",
    "retrievedAt": "2026-10-29T00:14:29Z",
    "resolver": "github-avatar"
  },
  "source": {
    "repo": "prajapatimehul/claude-aws-cost-saver",
    "url": "https://github.com/prajapatimehul/claude-aws-cost-saver",
    "commit": "761479eac21399bbe1a9be3345a73f246fa40435",
    "path": "plugins/aws-cost-saver",
    "license": "MIT",
    "licenseClass": "green",
    "stars": 23,
    "archived": false,
    "vendoredAt": "2026-10-28T23:50:34Z"
  },
  "neutralization": {
    "applied": true,
    "originalProvider": "claude",
    "changes": [
      {
        "file": ".claude-plugin/",
        "before": "active provider manifest",
        "after": "_upstream/provider-manifests/claude/.claude-plugin",
        "reason": "archive provider manifest; DipoleML manifest generated"
      },
      {
        "file": "dipoleml.json",
        "before": "Aws Cost Saver | Claude Code plugin that finds AWS cost savings. 163 checks across EC2, RDS, S3, Lambda, and 30+ services.",
        "after": "Aws Cost Saver | DipoleML plugin that finds AWS cost savings. 163 checks across EC2, RDS, S3, Lambda, and 30+ services.",
        "reason": "provider branding rewritten to DipoleML in generated metadata"
      },
      {
        "file": ".dipoleml-plugin/plugin.json",
        "before": "",
        "after": "generated",
        "reason": "DipoleML-native plugin manifest"
      }
    ]
  },
  "entrypoints": [
    {
      "kind": "mcp-stdio",
      "command": "${DIPOLEML_PLUGIN_ROOT}/scripts/start-mcp.sh",
      "args": []
    },
    {
      "kind": "plugin",
      "manifest": ".dipoleml-plugin/plugin.json"
    }
  ],
  "requirements": {
    "runtimes": [],
    "packages": [],
    "env": [],
    "credentials": []
  },
  "compatibility": {
    "upstreamProviders": [
      "claude"
    ],
    "notes": "Upstream executable code is unmodified. Provider manifests are archived under _upstream/ and DipoleML metadata is authoritative. Upstream plugin scripts may reference CLAUDE_PLUGIN_ROOT; the DipoleML loader must set it as an alias for DIPOLEML_PLUGIN_ROOT.",
    "dipoleml": ">=1.0"
  },
  "files": {
    "manifest": "dipoleml.json",
    "readme": "DIPOLEML.md",
    "license": "LICENSE",
    "logo": "logo.png"
  },
  "quality": {
    "validated": false,
    "checks": [
      "license:MIT",
      "provider-archived",
      "manifest-generated"
    ]
  }
}
